{
  "role": "perf",
  "round": 1,
  "verdict": "approved",
  "issues": [
    {
      "severity": "minor",
      "location": "§ 监控与告警",
      "problem": "缺少 Redis 连接池利用率监控",
      "suggested_fix": "增加 rec_widget_redis_pool_usage 指标和 >80% 告警",
      "rationale": "*(KB: 无先例)* 但 Redis 连接池耗尽是常见故障模式"
    }
  ],
  "must_answer_updates": [
    {"id": "observability", "status": "draft"},
    {"id": "rate_limit", "status": "draft"},
    {"id": "cache_strategy", "status": "draft"},
    {"id": "hotspot", "status": "draft"}
  ],
  "open_questions_for_human": []
}
